{
  "name": "admin_password",
  "label": "Status page password",
  "description": "Leave empty to get a strong password generated for you.",
  "type": "password",
  "required": true,
  "generate": "password",
  "i18n": {
    "fa": {
      "label": "رمز صفحه‌ی وضعیت",
      "description": "خالی بگذارید تا یک رمز قوی ساخته شود."
    }
  }
}
