{
  "name": "cf_api_token",
  "label": "Cloudflare API token",
  "description": "A token with Zone:Edit and DNS:Edit permissions.",
  "type": "secret",
  "required": true,
  "sensitive": true,
  "i18n": {
    "fa": {
      "label": "توکن API کلودفلر",
      "description": "توکنی با دسترسی ویرایش Zone و DNS."
    }
  }
}
